"Item #","Category","Item","Qty","Original MPN","Manufacturer/Brand","Octopart MPN to Order","Match Type","Octopart Link","Mouser Link","Mouser Part Number","Notes"
"1","Core Electronics","MCU Board","1","ABX00027","Arduino","ABX00027","Search Needed","https://octopart.com/search?q=ABX00027","https://www.mouser.com/new/arduino/arduino-nano-33-iot/","ABX00027","No clean indexed Octopart product page found; verify exact board listing before order."
"2","Core Electronics","External ADC Module","1","Adafruit 1085 (ADS1115 breakout)","Adafruit","ADS1115IDGSR","Replacement","https://octopart.com/search?q=ADS1115IDGSR","https://eu.mouser.com/ProductDetail/Texas-Instruments/ADS1115IDGSR","ADS1115IDGSR","Use bare TI ADS1115 IC if breakout board is unavailable on Octopart; requires own mounting/interconnect."
"3","Core Electronics","Dual Op-Amp","1","MCP6022-I/P","Microchip","MCP6022-I/P","Exact","https://octopart.com/mcp6022-i%2Fp-microchip-419146","https://www.mouser.com/c/?q=MCP6022-I%2FP","MCP6022-I/P","Direct Octopart listing found."
"4","Core Electronics","Photodiode","1","BPW34","Vishay","VBPW34S","Replacement","https://octopart.com/vbpw34s-vishay-42877871","https://www.mouser.com/c/?q=BPW34","BPW34","BPW34-family substitute listed on Octopart."
"5","Core Electronics","NPN LED Driver Transistor","2","TIP31C","STMicroelectronics","TIP31C","Exact","https://octopart.com/tip31c-stmicroelectronics-15555","https://www.mouser.com/c/?q=TIP31C","TIP31C","STMicroelectronics TIP31C selected as the project-standard source."
"6","Core Electronics","730nm Source LED (per spec primary)","1","LST1-01G01-FRD1-00","New-Energy","LST1-01G01-FRD1-00","Exact","https://octopart.com/search?q=LST1-01G01-FRD1-00","https://www.mouser.com/ProductDetail/New-Energy/LST1-01G01-FRD1-00?qs=wd5RIQLrsJi1z5h%252BFO29xg%3D%3D","LST1-01G01-FRD1-00","Mouser stocked Star Board; requires rubber washer baffle for optical isolation."
"7","Core Electronics","850nm Source LED (per spec primary)","1","SFH4253B","ams OSRAM","SFH4253B","Exact","https://octopart.com/search?q=SFH4253B","https://ams-osram.com/products/leds/ir-leds/osram-topled-sfh-4253b","SFH4253B","Commonly stocked 850nm emitter (SMT PLCC-2, 120 deg beam). Mount on small carrier board and revalidate drive current under final build as part of V&V."
"8","Resistors","LED current resistor (730nm channel)","1","CFR-50JB-52-68R","YAGEO","CFR-50JB-52-68R","Search Needed","https://octopart.com/search?q=CFR-50JB-52-68R","https://www.mouser.com/ProductDetail/YAGEO/CFR-50JB-52-68R","CFR-50JB-52-68R","Value changed to 68 Ohms to safely drive the high-power Star Board LED."
"9","Resistors","LED current resistor (850nm channel)","1","CFR-50JB-52-68R","YAGEO","CFR-50JB-52-68R","Search Needed","https://octopart.com/search?q=CFR-50JB-52-68R","https://www.mouser.com/ProductDetail/YAGEO/CFR-50JB-52-68R","CFR-50JB-52-68R","Value changed to 68 Ohms to resolve safety violation ISSUE-002."
"10","Resistors","Transistor base resistor","2","CFR-50JB-52-470R","YAGEO","CFR-50JB-52-470R","Search Needed","https://octopart.com/search?q=CFR-50JB-52-470R","https://www.mouser.com/ProductDetail/YAGEO/CFR-50JB-52-470R","CFR-50JB-52-470R","Series appears on Octopart but exact value not cleanly indexed in search results."
"11","Resistors","TIA feedback resistor","1","MFR-25FBF52-100K","YAGEO","MFR-25FBF52-100K","Search Needed","https://octopart.com/search?q=MFR-25FBF52-100K","https://www.mouser.com/ProductDetail/YAGEO/MFR-25FBF52-100K","MFR-25FBF52-100K","Family is listed; use matrix/search page to select exact resistance."
"12","Resistors","Stage-2 feedback resistor","1","MFR-25FBF52-47K","YAGEO","MFR-25FBF52-47K","Search Needed","https://octopart.com/search?q=MFR-25FBF52-47K","https://www.mouser.com/ProductDetail/YAGEO/MFR-25FBF52-47K","MFR-25FBF52-47K","Family is listed; use matrix/search page to select exact resistance."
"13","Resistors","Stage-2 gain set resistor","1","MFR-25FBF52-1K","YAGEO","MFR-25FBF52-1K","Exact","https://octopart.com/datasheet/mfr-25fbf52-1k-yageo-18902051","https://www.mouser.com/ProductDetail/YAGEO/MFR-25FBF52-1K","MFR-25FBF52-1K","Exact MPN indexed via Octopart datasheet entry."
"14","Capacitors","TIA compensation capacitor","1","FG18C0G1H4R7CNT00","TDK","FG18C0G1H4R7CNT00","Exact","https://octopart.com/search?q=FG18C0G1H4R7CNT00","https://www.mouser.com/ProductDetail/TDK/FG18C0G1H4R7CNT00","FG18C0G1H4R7CNT00","Electrical fit is exact (4.7pF C0G 50V); lifecycle is NRND, so keep a qualified alternate."
"15","Capacitors","Local high-frequency decoupling capacitors","2","C315C104K5R5TA7301","KEMET","C315C104K5R5TA7301","Search Needed","https://octopart.com/search?q=C315C104K5R5TA7301","https://www.mouser.com/ProductDetail/KEMET/C315C104K5R5TA","C315C104K5R5TA","Fixed from Z5U to X7R dielectric."
"16","Capacitors","5V rail bulk capacitor","1","EEU-FR1A101B","Panasonic","EEUFR1H101","Replacement","https://octopart.com/eeufr1h101-panasonic-13148190","https://www.mouser.com/ProductDetail/Panasonic/EEU-FR1A101B","EEU-FR1A101B","100uF FR-series substitute found with higher voltage class."
"17","Capacitors","Analog 3.3V rail bulk capacitor","1","ECE-A1VKS100B","Panasonic","ECE-A1VKS100B","Exact","https://octopart.com/search?q=ECE-A1VKS100B","https://www.mouser.com/ProductDetail/Panasonic/ECE-A1VKS100B","ECE-A1VKS100B","Panasonic 10uF 35V electrolytic; meets 10uF and >=6.3V spec for analog 3.3V bulk decoupling."
"18","Protection and Power","Input fuse","1","0215.500MXP","Littelfuse","0215.500MXP","Search Needed","https://octopart.com/search?q=0215.500MXP","https://www.mouser.com/c/?q=0215.500MXP","0215.500MXP","Exact 500mA 5x20 slow-blow listing not returned in web indexing; verify in Octopart with param filters."
"19","Protection and Power","5V external wall adapter","1","GS06E-1P1J","MEAN WELL","GE12I05-P1J","Replacement","https://octopart.com/ge12i05-p1j-mean+well-9568572","https://www.mouser.com/c/?q=GE12I05-P1J","GE12I05-P1J","5V Mean Well wall adapter replacement with similar connector family."
"20","Mechanical and Integration Materials","Elastic headband (2cm width)","1","Generic non-conductive elastic headband, 20mm width","Generic","3339913 (RS Pro APLIX 800 strap family)","Replacement","https://octopart.com/search?q=3339913","","","Hook-and-loop strap replacement from Octopart ecosystem; confirm comfort/fit for wearable use."
"21","Mechanical and Integration Materials","Black EVA foam block/sheet","1","Generic black EVA foam","Generic","6191786","Replacement","https://octopart.com/6191786-rs+pro-76762896","","","Adhesive black EPDM foam tape replacement."
"22","Mechanical and Integration Materials","Shielded cable for photodiode lead","1 length (<= 5cm)","30 AWG shielded cable, single-pair or miniature coax","Generic","C1156.41.01","Replacement","https://octopart.com/c1156.41.01-general+cable+%2F+carol-47574872","https://www.mouser.com/c/wire-cable/coaxial-cables/?rg+type=RG-174%2FU","RG-174/U","RG174-class shielded coax replacement."
"23","Mechanical and Integration Materials","Opaque adhesive/tape for optical isolation","1 roll","3M Super 33+","3M","88-SUPER-1-1/2X44FT","Replacement","https://octopart.com/88-super-1-1%2F2x44ft-3m-9585526","https://www.mouser.com/c/?q=Super%2033%2B%20tape","Super 33+","Octopart-listed 3M Super 88 electrical tape replacement."
"24","Mechanical and Integration Materials","Breadboard/perfboard + hookup wire","1 set","Standard 2.54mm prototyping supplies","Generic","PROTO KIT","Replacement","https://octopart.com/proto+kit-jameco+valuepro-111732496","https://www.mouser.com/new/bps/bps-breadboards/","BR1","830-point breadboard plus jumper kit from Octopart listing."
"25","Mechanical and Integration Materials","USB cable (for Nano 33 IoT to host)","1","USB data cable compatible with Nano 33 IoT connector","Generic","USBAUB50CMRA","Replacement","https://octopart.com/search?q=USBAUB50CMRA","https://www.mouser.com/c/?q=USBAUB50CMRA","USBAUB50CMRA","USB-A to Micro-B cable class replacement; verify connector orientation/length."
"26","Mechanical and Integration Materials","Black Rubber Washers (Optical Baffle)","1 pack","#4 or M3 flat black rubber washer","Generic","","","","","","~1/8 inch ID. Used to restrict 730nm LED beam angle."
